{
  "$schema": "https://json-schema.org/draft/2020-12/schema",
  "type": "object",
  "additionalProperties": false,
  "required": [
    "schema_version",
    "mode",
    "repositories",
    "principals",
    "feature_flags"
  ],
  "properties": {
    "schema_version": { "const": 1 },
    "mode": { "enum": ["disabled", "shadow", "enforced"] },
    "repositories": { "type": "array" },
    "principals": { "type": "array" },
    "feature_flags": {
      "type": "object",
      "additionalProperties": { "type": "boolean" }
    }
  }
}
