{
  "schema_version": 1,
  "mode": "enforced",
  "repositories": [
    {
      "repo_id": "repo-one",
      "remote_identity": "https://github.com/example/repo.git",
      "default_branch": "main",
      "config_digest": "sha256:aaaaaaaaaaaaaaaaaaaaaaaaaaaaaaaaaaaaaaaaaaaaaaaaaaaaaaaaaaaaaaaa"
    }
  ],
  "principals": [
    {
      "principal_id": "godbee-main",
      "class_id": "gottbiene",
      "parent_principal_id": null,
      "repo_id": null
    },
    {
      "principal_id": "queen-repo-one",
      "class_id": "koenigin",
      "parent_principal_id": "godbee-main",
      "repo_id": "repo-one"
    }
  ],
  "feature_flags": {
    "sp0_passive": false,
    "sp1_deadline": false,
    "sp2_secondary_model": false,
    "sp3_fairness": false
  }
}
